System,Version,Code,Display
http://snomed.info/sct,2020-03,111482003,Subchronic schizophrenia with acute exacerbations (disorder)
http://snomed.info/sct,2020-03,111483008,Catatonic schizophrenia in remission (disorder)
http://snomed.info/sct,2020-03,111484002,Undifferentiated schizophrenia (disorder)
http://snomed.info/sct,2020-03,12939007,Chronic disorganized schizophrenia (disorder)
http://snomed.info/sct,2020-03,14291003,Subchronic disorganized schizophrenia with acute exacerbations (disorder)
http://snomed.info/sct,2020-03,16990005,Subchronic schizophrenia (disorder)
http://snomed.info/sct,2020-03,191526005,Schizophrenic disorders (disorder)
http://snomed.info/sct,2020-03,191527001,Simple schizophrenia (disorder)
http://snomed.info/sct,2020-03,191531007,Acute exacerbation of chronic schizophrenia (disorder)
http://snomed.info/sct,2020-03,191542003,Catatonic schizophrenia (disorder)
http://snomed.info/sct,2020-03,191547009,Acute exacerbation of subchronic catatonic schizophrenia (disorder)
http://snomed.info/sct,2020-03,191548004,Acute exacerbation of chronic catatonic schizophrenia (disorder)
http://snomed.info/sct,2020-03,191554003,Acute exacerbation of subchronic paranoid schizophrenia (disorder)
http://snomed.info/sct,2020-03,191555002,Acute exacerbation of chronic paranoid schizophrenia (disorder)
http://snomed.info/sct,2020-03,191559008,Latent schizophrenia (disorder)
http://snomed.info/sct,2020-03,191561004,Subchronic latent schizophrenia (disorder)
http://snomed.info/sct,2020-03,191562006,Chronic latent schizophrenia (disorder)
http://snomed.info/sct,2020-03,191563001,Acute exacerbation of subchronic latent schizophrenia (disorder)
http://snomed.info/sct,2020-03,191564007,Acute exacerbation of chronic latent schizophrenia (disorder)
http://snomed.info/sct,2020-03,191567000,Schizoaffective schizophrenia (disorder)
http://snomed.info/sct,2020-03,191569002,Subchronic schizoaffective schizophrenia (disorder)
http://snomed.info/sct,2020-03,191570001,Chronic schizoaffective schizophrenia (disorder)
http://snomed.info/sct,2020-03,191571002,Acute exacerbation of subchronic schizoaffective schizophrenia (disorder)
http://snomed.info/sct,2020-03,191572009,Acute exacerbation of chronic schizoaffective schizophrenia (disorder)
http://snomed.info/sct,2020-03,191574005,Schizoaffective schizophrenia in remission (disorder)
http://snomed.info/sct,2020-03,191577003,Cenesthopathic schizophrenia (disorder)
http://snomed.info/sct,2020-03,191680007,Psychogenic paranoid psychosis (disorder)
http://snomed.info/sct,2020-03,231437006,Reactive psychoses (disorder)
http://snomed.info/sct,2020-03,231489001,Acute transient psychotic disorder (disorder)
http://snomed.info/sct,2020-03,247804008,Schizophrenic prodrome (disorder)
http://snomed.info/sct,2020-03,26025008,Residual schizophrenia (disorder)
http://snomed.info/sct,2020-03,268617001,Acute schizophrenic episode (disorder)
http://snomed.info/sct,2020-03,268624000,Acute paranoid reaction (disorder)
http://snomed.info/sct,2020-03,270901009,Schizoaffective disorder, mixed type (disorder)
http://snomed.info/sct,2020-03,271428004,Schizoaffective disorder, manic type (disorder)
http://snomed.info/sct,2020-03,27387000,Subchronic disorganized schizophrenia (disorder)
http://snomed.info/sct,2020-03,274952002,Borderline schizophrenia (disorder)
http://snomed.info/sct,2020-03,278853003,Acute schizophrenia-like psychotic disorder (disorder)
2.16.840.1.113883.6.103,2013,295.00,Simple type schizophrenia, unspecified
2.16.840.1.113883.6.103,2013,295.01,Simple type schizophrenia, subchronic
2.16.840.1.113883.6.103,2013,295.02,Simple type schizophrenia, chronic
2.16.840.1.113883.6.103,2013,295.03,Simple type schizophrenia, subchronic with acute exacerbation
2.16.840.1.113883.6.103,2013,295.04,Simple type schizophrenia, chronic with acute exacerbation
2.16.840.1.113883.6.103,2013,295.05,Simple type schizophrenia, in remission
2.16.840.1.113883.6.103,2013,295.10,Disorganized type schizophrenia, unspecified
2.16.840.1.113883.6.103,2013,295.11,Disorganized type schizophrenia, subchronic
2.16.840.1.113883.6.103,2013,295.12,Disorganized type schizophrenia, chronic
2.16.840.1.113883.6.103,2013,295.13,Disorganized type schizophrenia, subchronic with acute exacerbation
2.16.840.1.113883.6.103,2013,295.14,Disorganized type schizophrenia, chronic with acute exacerbation
2.16.840.1.113883.6.103,2013,295.15,Disorganized type schizophrenia, in remission
2.16.840.1.113883.6.103,2013,295.20,Catatonic type schizophrenia, unspecified
2.16.840.1.113883.6.103,2013,295.21,Catatonic type schizophrenia, subchronic
2.16.840.1.113883.6.103,2013,295.22,Catatonic type schizophrenia, chronic
2.16.840.1.113883.6.103,2013,295.23,Catatonic type schizophrenia, subchronic with acute exacerbation
2.16.840.1.113883.6.103,2013,295.24,Catatonic type schizophrenia, chronic with acute exacerbation
2.16.840.1.113883.6.103,2013,295.25,Catatonic type schizophrenia, in remission
2.16.840.1.113883.6.103,2013,295.30,Paranoid type schizophrenia, unspecified
2.16.840.1.113883.6.103,2013,295.31,Paranoid type schizophrenia, subchronic
2.16.840.1.113883.6.103,2013,295.32,Paranoid type schizophrenia, chronic
2.16.840.1.113883.6.103,2013,295.33,Paranoid type schizophrenia, subchronic with acute exacerbation
2.16.840.1.113883.6.103,2013,295.34,Paranoid type schizophrenia, chronic with acute exacerbation
2.16.840.1.113883.6.103,2013,295.35,Paranoid type schizophrenia, in remission
2.16.840.1.113883.6.103,2013,295.40,Schizophreniform disorder, unspecified
2.16.840.1.113883.6.103,2013,295.41,Schizophreniform disorder, subchronic
2.16.840.1.113883.6.103,2013,295.42,Schizophreniform disorder, chronic
2.16.840.1.113883.6.103,2013,295.43,Schizophreniform disorder, subchronic with acute exacerbation
2.16.840.1.113883.6.103,2013,295.44,Schizophreniform disorder, chronic with acute exacerbation
2.16.840.1.113883.6.103,2013,295.45,Schizophreniform disorder, in remission
2.16.840.1.113883.6.103,2013,295.50,Latent schizophrenia, unspecified
2.16.840.1.113883.6.103,2013,295.51,Latent schizophrenia, subchronic
2.16.840.1.113883.6.103,2013,295.52,Latent schizophrenia, chronic
2.16.840.1.113883.6.103,2013,295.53,Latent schizophrenia, subchronic with acute exacerbation
2.16.840.1.113883.6.103,2013,295.54,Latent schizophrenia, chronic with acute exacerbation
2.16.840.1.113883.6.103,2013,295.55,Latent schizophrenia, in remission
2.16.840.1.113883.6.103,2013,295.60,Schizophrenic disorders, residual type, unspecified
2.16.840.1.113883.6.103,2013,295.61,Schizophrenic disorders, residual type, subchronic
2.16.840.1.113883.6.103,2013,295.62,Schizophrenic disorders, residual type, chronic
2.16.840.1.113883.6.103,2013,295.63,Schizophrenic disorders, residual type, subchronic with acute exacerbation
2.16.840.1.113883.6.103,2013,295.64,Schizophrenic disorders, residual type, chronic with acute exacerbation
2.16.840.1.113883.6.103,2013,295.65,Schizophrenic disorders, residual type, in remission
2.16.840.1.113883.6.103,2013,295.70,Schizoaffective disorder, unspecified
2.16.840.1.113883.6.103,2013,295.71,Schizoaffective disorder, subchronic
2.16.840.1.113883.6.103,2013,295.72,Schizoaffective disorder, chronic
2.16.840.1.113883.6.103,2013,295.73,Schizoaffective disorder, subchronic with acute exacerbation
2.16.840.1.113883.6.103,2013,295.74,Schizoaffective disorder, chronic with acute exacerbation
2.16.840.1.113883.6.103,2013,295.75,Schizoaffective disorder, in remission
2.16.840.1.113883.6.103,2013,295.80,Other specified types of schizophrenia, unspecified
2.16.840.1.113883.6.103,2013,295.81,Other specified types of schizophrenia, subchronic
2.16.840.1.113883.6.103,2013,295.82,Other specified types of schizophrenia, chronic
2.16.840.1.113883.6.103,2013,295.83,Other specified types of schizophrenia, subchronic with acute exacerbation
2.16.840.1.113883.6.103,2013,295.84,Other specified types of schizophrenia, chronic with acute exacerbation
2.16.840.1.113883.6.103,2013,295.85,Other specified types of schizophrenia, in remission
2.16.840.1.113883.6.103,2013,295.90,Unspecified schizophrenia, unspecified
2.16.840.1.113883.6.103,2013,295.91,Unspecified schizophrenia, subchronic
2.16.840.1.113883.6.103,2013,295.92,Unspecified schizophrenia, chronic
2.16.840.1.113883.6.103,2013,295.93,Unspecified schizophrenia, subchronic with acute exacerbation
2.16.840.1.113883.6.103,2013,295.94,Unspecified schizophrenia, chronic with acute exacerbation
2.16.840.1.113883.6.103,2013,295.95,Unspecified schizophrenia, in remission
http://snomed.info/sct,2020-03,29599000,Chronic undifferentiated schizophrenia (disorder)
2.16.840.1.113883.6.103,2013,298.0,Depressive type psychosis
2.16.840.1.113883.6.103,2013,298.1,Excitative type psychosis
2.16.840.1.113883.6.103,2013,298.4,Psychogenic paranoid psychosis
2.16.840.1.113883.6.103,2013,298.8,Other and unspecified reactive psychosis
2.16.840.1.113883.6.103,2013,298.9,Unspecified psychosis
http://snomed.info/sct,2020-03,30336007,Chronic residual schizophrenia with acute exacerbations (disorder)
http://snomed.info/sct,2020-03,31027006,Schizotypal personality disorder (disorder)
http://snomed.info/sct,2020-03,31373002,Disorganized schizophrenia in remission (disorder)
http://snomed.info/sct,2020-03,31658008,Chronic paranoid schizophrenia (disorder)
http://snomed.info/sct,2020-03,35218008,Chronic disorganized schizophrenia with acute exacerbation (disorder)
http://snomed.info/sct,2020-03,35252006,Disorganized schizophrenia (disorder)
http://snomed.info/sct,2020-03,36158005,Schizophreniform disorder with good prognostic features (disorder)
http://snomed.info/sct,2020-03,38368003,Schizoaffective disorder, bipolar type (disorder)
http://snomed.info/sct,2020-03,39610001,Undifferentiated schizophrenia in remission (disorder)
http://snomed.info/sct,2020-03,416340002,Late onset schizophrenia (disorder)
http://snomed.info/sct,2020-03,42868002,Subchronic catatonic schizophrenia (disorder)
http://snomed.info/sct,2020-03,441704009,Affective psychosis (disorder)
http://snomed.info/sct,2020-03,441833000,Lethal catatonia (disorder)
http://snomed.info/sct,2020-03,4926007,Schizophrenia in remission (disorder)
http://snomed.info/sct,2020-03,51133006,Residual schizophrenia in remission (disorder)
http://snomed.info/sct,2020-03,5464005,Brief reactive psychosis (disorder)
http://snomed.info/sct,2020-03,55736003,Schizophreniform disorder without good prognostic features (disorder)
http://snomed.info/sct,2020-03,58214004,Schizophrenia (disorder)
http://snomed.info/sct,2020-03,63181006,Paranoid schizophrenia in remission (disorder)
http://snomed.info/sct,2020-03,64905009,Paranoid schizophrenia (disorder)
http://snomed.info/sct,2020-03,68890003,Schizoaffective disorder (disorder)
http://snomed.info/sct,2020-03,68995007,Chronic catatonic schizophrenia (disorder)
http://snomed.info/sct,2020-03,7025000,Subchronic undifferentiated schizophrenia with acute exacerbations (disorder)
http://snomed.info/sct,2020-03,70814008,Subchronic residual schizophrenia with acute exacerbations (disorder)
http://snomed.info/sct,2020-03,71103003,Chronic residual schizophrenia (disorder)
http://snomed.info/sct,2020-03,76566000,Subchronic residual schizophrenia (disorder)
http://snomed.info/sct,2020-03,79204003,Chronic undifferentiated schizophrenia with acute exacerbations (disorder)
http://snomed.info/sct,2020-03,79866005,Subchronic paranoid schizophrenia (disorder)
http://snomed.info/sct,2020-03,83746006,Chronic schizophrenia (disorder)
http://snomed.info/sct,2020-03,84760002,Schizoaffective disorder, depressive type (disorder)
http://snomed.info/sct,2020-03,85861002,Subchronic undifferentiated schizophrenia (disorder)
http://snomed.info/sct,2020-03,88975006,Schizophreniform disorder (disorder)
http://hl7.org/fhir/sid/icd-10-cm,2021,F20.0,Paranoid schizophrenia
http://hl7.org/fhir/sid/icd-10-cm,2021,F20.1,Disorganized schizophrenia
http://hl7.org/fhir/sid/icd-10-cm,2021,F20.2,Catatonic schizophrenia
http://hl7.org/fhir/sid/icd-10-cm,2021,F20.3,Undifferentiated schizophrenia
http://hl7.org/fhir/sid/icd-10-cm,2021,F20.5,Residual schizophrenia
http://hl7.org/fhir/sid/icd-10-cm,2021,F20.81,Schizophreniform disorder
http://hl7.org/fhir/sid/icd-10-cm,2021,F20.89,Other schizophrenia
http://hl7.org/fhir/sid/icd-10-cm,2021,F20.9,Schizophrenia, unspecified
http://hl7.org/fhir/sid/icd-10-cm,2021,F21,Schizotypal disorder
http://hl7.org/fhir/sid/icd-10-cm,2021,F23,Brief psychotic disorder
http://hl7.org/fhir/sid/icd-10-cm,2021,F25.0,Schizoaffective disorder, bipolar type
http://hl7.org/fhir/sid/icd-10-cm,2021,F25.1,Schizoaffective disorder, depressive type
http://hl7.org/fhir/sid/icd-10-cm,2021,F25.8,Other schizoaffective disorders
http://hl7.org/fhir/sid/icd-10-cm,2021,F25.9,Schizoaffective disorder, unspecified
http://hl7.org/fhir/sid/icd-10-cm,2021,F28,Other psychotic disorder not due to a substance or known physiological condition
http://hl7.org/fhir/sid/icd-10-cm,2021,F29,Unspecified psychosis not due to a substance or known physiological condition