System,Version,Code,Display
http://snomed.info/sct,2021-03,102481003,Generalized chronic body pains (finding)
http://snomed.info/sct,2021-03,102557007,Arm claudication (finding)
http://snomed.info/sct,2021-03,109771000119103,Chronic postoperative pain (finding)
http://snomed.info/sct,2021-03,111985007,Chronic abdominal pain (finding)
http://snomed.info/sct,2021-03,1121000119107,Chronic neck pain (finding)
http://snomed.info/sct,2021-03,113611000119100,Myofascial pain syndrome of lumbar spine (disorder)
http://snomed.info/sct,2021-03,11892641000119101,Chronic female pelvic pain syndrome (disorder)
http://snomed.info/sct,2021-03,121021000119105,New daily persistent headache (disorder)
http://snomed.info/sct,2021-03,12236951000119108,Intermittent claudication of bilateral lower limbs co-occurrent and due to atherosclerosis (finding)
http://snomed.info/sct,2021-03,12237071000119100,Intermittent claudication of left lower limb co-occurrent and due to atherosclerosis (finding)
http://snomed.info/sct,2021-03,12237191000119103,Intermittent claudication of right lower limb co-occurrent and due to atherosclerosis (finding)
http://snomed.info/sct,2021-03,12400141000119103,Chronic pain following bilateral total hip arthroplasty (finding)
http://snomed.info/sct,2021-03,12400181000119108,Chronic pain following bilateral total knee arthroplasty (finding)
http://snomed.info/sct,2021-03,12400221000119100,Chronic pain following left total hip arthroplasty (finding)
http://snomed.info/sct,2021-03,12400261000119105,Chronic pain following left total knee arthroplasty (finding)
http://snomed.info/sct,2021-03,12400301000119102,Chronic pain following right total hip arthroplasty (finding)
http://snomed.info/sct,2021-03,12400341000119100,Chronic pain following right total knee arthroplasty (finding)
http://snomed.info/sct,2021-03,124161000119104,Chronic migraine without aura with status migrainosus (disorder)
http://snomed.info/sct,2021-03,124171000119105,Chronic intractable migraine without aura (disorder)
http://snomed.info/sct,2021-03,128200000,Complex regional pain syndrome (disorder)
http://snomed.info/sct,2021-03,129501000119107,Chronic sacral pain for greater than three months (finding)
http://snomed.info/sct,2021-03,129511000119105,Chronic pain in coccyx for more than three months (finding)
http://snomed.info/sct,2021-03,133731000119108,Chronic pain in male pelvis (finding)
http://snomed.info/sct,2021-03,134407002,Chronic back pain (finding)
http://snomed.info/sct,2021-03,136791000119103,Chronic thoracic back pain (finding)
http://snomed.info/sct,2021-03,14150005,Alteration in comfort: chronic pain (finding)
http://snomed.info/sct,2021-03,15743521000119108,Chronic pain of right upper limb (finding)
http://snomed.info/sct,2021-03,15743561000119103,Chronic pain of left upper limb (finding)
http://snomed.info/sct,2021-03,15749801000119104,Chronic pain of bilateral feet (finding)
http://snomed.info/sct,2021-03,16002671000119106,Chronic pain of bilateral upper limbs (finding)
http://snomed.info/sct,2021-03,16002871000119105,Chronic pain of right foot (finding)
http://snomed.info/sct,2021-03,16002911000119108,Chronic pain of left foot (finding)
http://snomed.info/sct,2021-03,16013431000119104,Intermittent claudication of bilateral lower limbs due to atherosclerosis of nonbiological bypass graft (finding)
http://snomed.info/sct,2021-03,16013711000119104,Intermittent claudication of right lower limb co-occurrent and due to atherosclerosis of bypass graft (disorder)
http://snomed.info/sct,2021-03,16014031000119109,Intermittent claudication of left lower limb co-occurrent and due to atherosclerosis of bypass graft (disorder)
http://snomed.info/sct,2021-03,16014071000119107,Intermittent claudication of bilateral lower limbs co-occurrent and due to atherosclerosis of bypass graft (disorder)
http://snomed.info/sct,2021-03,16058471000119101,Complex regional pain syndrome type 2 of bilateral lower limbs (disorder)
http://snomed.info/sct,2021-03,16058511000119105,Complex regional pain syndrome type 2 of bilateral upper limbs (disorder)
http://snomed.info/sct,2021-03,16206661000119108,Reflex sympathetic dystrophy of bilateral upper limbs (disorder)
http://snomed.info/sct,2021-03,16580691000119107,Chronic urinary bladder pain (finding)
http://snomed.info/sct,2021-03,16754391000119100,Stable angina due to coronary arteriosclerosis (disorder)
http://snomed.info/sct,2021-03,193184006,Chronic painful neuropathy due to diabetes mellitus (disorder)
http://snomed.info/sct,2021-03,201311005,Painful operation scar (finding)
http://snomed.info/sct,2021-03,203082005,Fibromyalgia (disorder)
http://snomed.info/sct,2021-03,230477005,Chronic post-traumatic headache (disorder)
http://snomed.info/sct,2021-03,230575000,Chronic painful polyneuropathy due to diabetes mellitus (disorder)
http://snomed.info/sct,2021-03,230648001,Abdominal cutaneous nerve entrapment syndrome (disorder)
http://snomed.info/sct,2021-03,233819005,Stable angina (disorder)
http://snomed.info/sct,2021-03,235841007,Chronic nonspecific abdominal pain (finding)
http://snomed.info/sct,2021-03,237067000,Chronic pain in female pelvis (finding)
http://snomed.info/sct,2021-03,271858001,Recurrent acute abdominal pain (finding)
http://snomed.info/sct,2021-03,274665008,Chronic intractable pain (finding)
http://snomed.info/sct,2021-03,279030006,Myofascial pain syndrome of neck (disorder)
http://snomed.info/sct,2021-03,279032003,Chronic pelvic pain without obvious pathology (finding)
http://snomed.info/sct,2021-03,279036000,Myofascial pain syndrome of thorax (disorder)
http://snomed.info/sct,2021-03,279041008,Myofascial pain syndrome of lower back (disorder)
http://snomed.info/sct,2021-03,279047007,Persistent pain following procedure (finding)
http://snomed.info/sct,2021-03,279048002,Internal mammary artery syndrome (finding)
http://snomed.info/sct,2021-03,290441000119105,Intractable chronic headache following trauma (disorder)
http://snomed.info/sct,2021-03,291761000119107,Complex regional pain syndrome type II of left upper limb (disorder)
http://snomed.info/sct,2021-03,291771000119101,Complex regional pain syndrome type II of right upper limb (disorder)
http://snomed.info/sct,2021-03,291781000119103,Complex regional pain syndrome type II of left lower limb (disorder)
http://snomed.info/sct,2021-03,291791000119100,Complex regional pain syndrome type II of right lower limb (disorder)
http://snomed.info/sct,2021-03,293921000119104,Complex regional pain syndrome type I of bilateral upper limbs (disorder)
http://snomed.info/sct,2021-03,293931000119101,Complex regional pain syndrome type I of left lower limb (disorder)
http://snomed.info/sct,2021-03,293941000119105,Complex regional pain syndrome type I of left upper limb (disorder)
http://snomed.info/sct,2021-03,293951000119107,Complex regional pain syndrome type I of bilateral lower limbs (disorder)
http://snomed.info/sct,2021-03,293961000119109,Complex regional pain syndrome type I of right lower limb (disorder)
http://snomed.info/sct,2021-03,293971000119103,Complex regional pain syndrome type I of right upper limb (disorder)
http://snomed.info/sct,2021-03,294031000119103,Episodic paroxysmal hemicrania (disorder)
http://snomed.info/sct,2021-03,29930001000004103,Intractable low back pain (finding)
http://snomed.info/sct,2021-03,303081002,Neurogenic claudication (finding)
http://snomed.info/sct,2021-03,3061000119102,Chronic nonmalignant pain (finding)
http://snomed.info/sct,2021-03,314642004,Intermittent pain (finding)
http://snomed.info/sct,2021-03,35074008,Chronic idiopathic anal pain (disorder)
http://snomed.info/sct,2021-03,371806006,Progressive angina (disorder)
http://snomed.info/sct,2021-03,371808007,Recurrent angina status post percutaneous transluminal coronary angioplasty (disorder)
http://snomed.info/sct,2021-03,371809004,Recurrent angina status post coronary stent placement (disorder)
http://snomed.info/sct,2021-03,371810009,Recurrent angina status post coronary artery bypass graft (disorder)
http://snomed.info/sct,2021-03,371811008,Recurrent angina status post rotational atherectomy (disorder)
http://snomed.info/sct,2021-03,371812001,Recurrent angina status post directional coronary atherectomy (disorder)
http://snomed.info/sct,2021-03,373621006,Chronic pain syndrome (disorder)
http://snomed.info/sct,2021-03,38654001,Recurrent biliary colic (finding)
http://snomed.info/sct,2021-03,39402007,Pelvic congestion syndrome (disorder)
http://snomed.info/sct,2021-03,408749000,Complex regional pain syndrome, type II, lower limb (disorder)
http://snomed.info/sct,2021-03,408750000,Complex regional pain syndrome, type II, upper limb (disorder)
http://snomed.info/sct,2021-03,408751001,Complex regional pain syndrome, type II (disorder)
http://snomed.info/sct,2021-03,41321000119101,Myofascial pain syndrome of thoracic spine (disorder)
http://snomed.info/sct,2021-03,426135001,Chronic prostatitis - chronic pelvic pain syndrome (disorder)
http://snomed.info/sct,2021-03,426206001,Constant pain (finding)
http://snomed.info/sct,2021-03,426628005,Chronic vaginal pain (finding)
http://snomed.info/sct,2021-03,427419006,Transformed migraine (disorder)
http://snomed.info/sct,2021-03,431237007,Chronic headache disorder (disorder)
http://snomed.info/sct,2021-03,431481001,Chronic pain due to injury (finding)
http://snomed.info/sct,2021-03,431601000124105,Chronic migraine without aura (disorder)
http://snomed.info/sct,2021-03,432615008,Chronic pain in face (finding)
http://snomed.info/sct,2021-03,434011000124101,Chronic chest pain (finding)
http://snomed.info/sct,2021-03,437931000124100,Chronic migraine without aura, non-refractory (disorder)
http://snomed.info/sct,2021-03,43922008,Jaw claudication (finding)
http://snomed.info/sct,2021-03,439469002,Recurrent abdominal pain (finding)
http://snomed.info/sct,2021-03,441711008,Chronic psychogenic pain (disorder)
http://snomed.info/sct,2021-03,443095000,Hemicrania continua (disorder)
http://snomed.info/sct,2021-03,444746004,Acute exacerbation of chronic abdominal pain (finding)
http://snomed.info/sct,2021-03,458241000124102,Chronic daily headache (disorder)
http://snomed.info/sct,2021-03,51881000119109,Chronic ankle pain (finding)
http://snomed.info/sct,2021-03,571000119103,Daily headache (disorder)
http://snomed.info/sct,2021-03,631000119102,Chronic back pain greater than three months duration (finding)
http://snomed.info/sct,2021-03,63491006,Intermittent claudication (finding)
http://snomed.info/sct,2021-03,674051000119103,Chronic neck pain for greater than 3 months (finding)
http://snomed.info/sct,2021-03,699694000,Chronic post-concussion headache (disorder)
http://snomed.info/sct,2021-03,712537009,Complex regional pain syndrome of upper limb (disorder)
http://snomed.info/sct,2021-03,712826000,Intermittent headache (finding)
http://snomed.info/sct,2021-03,714252004,Post-mastectomy chronic pain syndrome (disorder)
http://snomed.info/sct,2021-03,722982003,Frequent episodic tension-type headache (disorder)
http://snomed.info/sct,2021-03,726531007,Myofascial pain syndrome (disorder)
http://snomed.info/sct,2021-03,734947007,Complex regional pain syndrome type I (disorder)
http://snomed.info/sct,2021-03,734986006,Complex regional pain syndrome of lower limb (disorder)
http://snomed.info/sct,2021-03,734987002,Complex regional pain syndrome of foot (disorder)
http://snomed.info/sct,2021-03,734988007,Complex regional pain syndrome of knee (disorder)
http://snomed.info/sct,2021-03,734989004,Complex regional pain syndrome of hand (disorder)
http://snomed.info/sct,2021-03,735644008,Chronic nociceptive pain (finding)
http://snomed.info/sct,2021-03,735935009,Chronic pain due to malignant neoplastic disease (finding)
http://snomed.info/sct,2021-03,735936005,Chronic neuropathic pain (finding)
http://snomed.info/sct,2021-03,736428003,Chronic arthralgia of temporomandibular joint (disorder)
http://snomed.info/sct,2021-03,736464002,Chronic idiopathic pain syndrome (disorder)
http://snomed.info/sct,2021-03,737305006,Primary chronic pain (disorder)
http://snomed.info/sct,2021-03,737306007,Chronic visceral pain (disorder)
http://snomed.info/sct,2021-03,762354003,Persistent headache due to and following injury of head (disorder)
http://snomed.info/sct,2021-03,762451005,Chronic pain following trauma (finding)
http://snomed.info/sct,2021-03,762452003,Chronic musculoskeletal pain (finding)
http://snomed.info/sct,2021-03,762454002,Chronic orofacial pain (finding)
http://snomed.info/sct,2021-03,762589002,Chronic primary visceral pain (disorder)
http://snomed.info/sct,2021-03,762590006,Chronic primary generalized pain (finding)
http://snomed.info/sct,2021-03,762591005,Chronic primary musculoskeletal pain (finding)
http://snomed.info/sct,2021-03,762592003,Chronic primary headache (disorder)
http://snomed.info/sct,2021-03,762593008,Chronic primary orofacial pain (finding)
http://snomed.info/sct,2021-03,762594002,Chronic pain following surgical procedure for cancer (disorder)
http://snomed.info/sct,2021-03,762595001,Chronic painful polyneuropathy following chemotherapy (disorder)
http://snomed.info/sct,2021-03,762596000,Chronic pain following radiotherapy (disorder)
http://snomed.info/sct,2021-03,762597009,Chronic musculoskeletal pain due to persistent inflammation (disorder)
http://snomed.info/sct,2021-03,762598004,Chronic musculoskeletal pain due to disease of nervous system (disorder)
http://snomed.info/sct,2021-03,762599007,Chronic mechanical visceral pain (disorder)
http://snomed.info/sct,2021-03,762600005,Chronic visceral pain due to vascular disorder (disorder)
http://snomed.info/sct,2021-03,762601009,Chronic visceral pain due to persistent inflammation (disorder)
http://snomed.info/sct,2021-03,762602002,Chronic central neuropathic pain (finding)
http://snomed.info/sct,2021-03,762603007,Chronic peripheral neuropathic pain (finding)
http://snomed.info/sct,2021-03,762604001,Chronic secondary facial pain (finding)
http://snomed.info/sct,2021-03,762605000,Chronic secondary oral pain (finding)
http://snomed.info/sct,2021-03,782661001,Chronic sacroiliac joint pain (finding)
http://snomed.info/sct,2021-03,785723001,Persistent idiopathic facial pain (disorder)
http://snomed.info/sct,2021-03,788891004,Chronic pain after cancer treatment (finding)
http://snomed.info/sct,2021-03,789494008,Central sensitization (finding)
http://snomed.info/sct,2021-03,792845002,Intermittent claudication due to atherosclerosis of artery of limb (finding)
http://snomed.info/sct,2021-03,82423001,Chronic pain (finding)
http://snomed.info/sct,2021-03,95417003,Primary fibromyalgia syndrome (disorder)
http://snomed.info/sct,2021-03,95443002,Venous intermittent claudication (finding)
http://snomed.info/sct,2021-03,95654002,Chronic paroxysmal hemicrania (disorder)
http://snomed.info/sct,2021-03,95657009,Chronic mixed headache syndrome (disorder)
http://snomed.info/sct,2021-03,98611000119104,Chronic post-thoracotomy pain syndrome (finding)
http://hl7.org/fhir/sid/icd-10-cm,2022,G89.0,Central pain syndrome
http://hl7.org/fhir/sid/icd-10-cm,2022,G89.21,Chronic pain due to trauma
http://hl7.org/fhir/sid/icd-10-cm,2022,G89.28,Other chronic postprocedural pain
http://hl7.org/fhir/sid/icd-10-cm,2022,G89.29,Other chronic pain
http://hl7.org/fhir/sid/icd-10-cm,2022,G89.4,Chronic pain syndrome
http://hl7.org/fhir/sid/icd-10-cm,2022,G90.511,Complex regional pain syndrome I of right upper limb
http://hl7.org/fhir/sid/icd-10-cm,2022,G90.512,Complex regional pain syndrome I of left upper limb
http://hl7.org/fhir/sid/icd-10-cm,2022,G90.513,Complex regional pain syndrome I of upper limb, bilateral
http://hl7.org/fhir/sid/icd-10-cm,2022,G90.521,Complex regional pain syndrome I of right lower limb
http://hl7.org/fhir/sid/icd-10-cm,2022,G90.522,Complex regional pain syndrome I of left lower limb
http://hl7.org/fhir/sid/icd-10-cm,2022,G90.523,Complex regional pain syndrome I of lower limb, bilateral
http://hl7.org/fhir/sid/icd-10-cm,2022,G90.529,Complex regional pain syndrome I of unspecified lower limb
http://hl7.org/fhir/sid/icd-10-cm,2022,G90.59,Complex regional pain syndrome I of other specified site
http://hl7.org/fhir/sid/icd-10-cm,2022,R52,Pain, unspecified